[
  {
    "conceptId": 1002289,
    "conceptName": "Metamyelocytes.neutrophilic/100 leukocytes in Bone marrow by Manual count",
    "conceptCode": "93952-0",
    "vocabularyId": "LOINC",
    "domainId": "Measurement",
    "recommendedUnitConceptId": 8554,
    "recommendedUnitName": "percent",
    "recommendedUnitCode": "%",
    "recommendedUnitVocabularyId": "UCUM"
  },
  {
    "conceptId": 3000285,
    "conceptName": "Sodium [Moles/volume] in Blood",
    "conceptCode": "2947-0",
    "vocabularyId": "LOINC",
    "domainId": "Measurement",
    "recommendedUnitConceptId": 8753,
    "recommendedUnitName": "millimole per liter",
    "recommendedUnitCode": "mmol/L",
    "recommendedUnitVocabularyId": "UCUM"
  },
  {
    "conceptId": 3000401,
    "conceptName": "Fibrin+Fibrinogen fragments [Mass/volume] in Platelet poor plasma",
    "conceptCode": "30226-5",
    "vocabularyId": "LOINC",
    "domainId": "Measurement",
    "recommendedUnitConceptId": 8636,
    "recommendedUnitName": "gram per liter",
    "recommendedUnitCode": "g/L",
    "recommendedUnitVocabularyId": "UCUM"
  },
  {
    "conceptId": 3002032,
    "conceptName": "Base excess in Venous blood by calculation",
    "conceptCode": "1927-3",
    "vocabularyId": "LOINC",
    "domainId": "Measurement",
    "recommendedUnitConceptId": 8753,
    "recommendedUnitName": "millimole per liter",
    "recommendedUnitCode": "mmol/L",
    "recommendedUnitVocabularyId": "UCUM"
  },
  {
    "conceptId": 3003129,
    "conceptName": "Base excess in Capillary blood by calculation",
    "conceptCode": "1926-5",
    "vocabularyId": "LOINC",
    "domainId": "Measurement",
    "recommendedUnitConceptId": 8753,
    "recommendedUnitName": "millimole per liter",
    "recommendedUnitCode": "mmol/L",
    "recommendedUnitVocabularyId": "UCUM"
  },
  {
    "conceptId": 3003396,
    "conceptName": "Base excess in Arterial blood by calculation",
    "conceptCode": "1925-7",
    "vocabularyId": "LOINC",
    "domainId": "Measurement",
    "recommendedUnitConceptId": 8753,
    "recommendedUnitName": "millimole per liter",
    "recommendedUnitCode": "mmol/L",
    "recommendedUnitVocabularyId": "UCUM"
  },
  {
    "conceptId": 3007359,
    "conceptName": "Bilirubin.indirect [Mass/volume] in Serum or Plasma",
    "conceptCode": "1971-1",
    "vocabularyId": "LOINC",
    "domainId": "Measurement",
    "recommendedUnitConceptId": 8840,
    "recommendedUnitName": "milligram per deciliter",
    "recommendedUnitCode": "mg/dL",
    "recommendedUnitVocabularyId": "UCUM"
  },
  {
    "conceptId": 3012501,
    "conceptName": "Base excess in Blood by calculation",
    "conceptCode": "11555-0",
    "vocabularyId": "LOINC",
    "domainId": "Measurement",
    "recommendedUnitConceptId": 8753,
    "recommendedUnitName": "millimole per liter",
    "recommendedUnitCode": "mmol/L",
    "recommendedUnitVocabularyId": "UCUM"
  },
  {
    "conceptId": 3013784,
    "conceptName": "Calcium.ionized [Moles/volume] in Serum or Plasma by Ion-selective membrane electrode (ISE)",
    "conceptCode": "12180-6",
    "vocabularyId": "LOINC",
    "domainId": "Measurement",
    "recommendedUnitConceptId": 8753,
    "recommendedUnitName": "millimole per liter",
    "recommendedUnitCode": "mmol/L",
    "recommendedUnitVocabularyId": "UCUM"
  },
  {
    "conceptId": 3020891,
    "conceptName": "Body temperature",
    "conceptCode": "8310-5",
    "vocabularyId": "LOINC",
    "domainId": "Measurement",
    "recommendedUnitConceptId": 586323,
    "recommendedUnitName": "degree Celsius",
    "recommendedUnitCode": "Cel",
    "recommendedUnitVocabularyId": "UCUM"
  },
  {
    "conceptId": 3033705,
    "conceptName": "Calcium.ionized [Moles/volume] in Venous blood",
    "conceptCode": "41645-3",
    "vocabularyId": "LOINC",
    "domainId": "Measurement",
    "recommendedUnitConceptId": 8753,
    "recommendedUnitName": "millimole per liter",
    "recommendedUnitCode": "mmol/L",
    "recommendedUnitVocabularyId": "UCUM"
  },
  {
    "conceptId": 3044331,
    "conceptName": "Calcium.ionized [Moles/volume] in Arterial blood",
    "conceptCode": "34581-9",
    "vocabularyId": "LOINC",
    "domainId": "Measurement",
    "recommendedUnitConceptId": 8753,
    "recommendedUnitName": "millimole per liter",
    "recommendedUnitCode": "mmol/L",
    "recommendedUnitVocabularyId": "UCUM"
  },
  {
    "conceptId": 3050068,
    "conceptName": "Calcium.ionized [Moles/volume] in Blood by Ion-selective membrane electrode (ISE)",
    "conceptCode": "47596-2",
    "vocabularyId": "LOINC",
    "domainId": "Measurement",
    "recommendedUnitConceptId": 8753,
    "recommendedUnitName": "millimole per liter",
    "recommendedUnitCode": "mmol/L",
    "recommendedUnitVocabularyId": "UCUM"
  },
  {
    "conceptId": 40762352,
    "conceptName": "Hemoglobin A1c/Hemoglobin.total in Blood by IFCC protocol",
    "conceptCode": "59261-8",
    "vocabularyId": "LOINC",
    "domainId": "Measurement",
    "recommendedUnitConceptId": 9579,
    "recommendedUnitName": "millimole per mole",
    "recommendedUnitCode": "mmol/mol",
    "recommendedUnitVocabularyId": "UCUM"
  },
  {
    "conceptId": 40762532,
    "conceptName": "Calcium.ionized [Mass/volume] in Arterial blood",
    "conceptCode": "59470-5",
    "vocabularyId": "LOINC",
    "domainId": "Measurement",
    "recommendedUnitConceptId": 8840,
    "recommendedUnitName": "milligram per deciliter",
    "recommendedUnitCode": "mg/dL",
    "recommendedUnitVocabularyId": "UCUM"
  },
  {
    "conceptId": 40762533,
    "conceptName": "Calcium.ionized [Mass/volume] in Venous blood",
    "conceptCode": "59471-3",
    "vocabularyId": "LOINC",
    "domainId": "Measurement",
    "recommendedUnitConceptId": 8840,
    "recommendedUnitName": "milligram per deciliter",
    "recommendedUnitCode": "mg/dL",
    "recommendedUnitVocabularyId": "UCUM"
  },
  {
    "conceptId": 4215838,
    "conceptName": "Inspiratory pressure setting",
    "conceptCode": "417071008",
    "vocabularyId": "SNOMED",
    "domainId": "Observation",
    "recommendedUnitConceptId": 44777590,
    "recommendedUnitName": "centimeter watercolumn",
    "recommendedUnitCode": "cm[H2O]",
    "recommendedUnitVocabularyId": "UCUM"
  },
  {
    "conceptId": 4353713,
    "conceptName": "Positive end expiratory pressure",
    "conceptCode": "250854009",
    "vocabularyId": "SNOMED",
    "domainId": "Observation",
    "recommendedUnitConceptId": 44777590,
    "recommendedUnitName": "centimeter watercolumn",
    "recommendedUnitCode": "cm[H2O]",
    "recommendedUnitVocabularyId": "UCUM"
  },
  {
    "conceptId": 4216746,
    "conceptName": "Positive end expiratory pressure setting",
    "conceptCode": "416595007",
    "vocabularyId": "SNOMED",
    "domainId": "Observation",
    "recommendedUnitConceptId": 44777590,
    "recommendedUnitName": "centimeter watercolumn",
    "recommendedUnitCode": "cm[H2O]",
    "recommendedUnitVocabularyId": "UCUM"
  },
  {
    "conceptId": 3022875,
    "conceptName": "Positive end expiratory pressure setting Ventilator",
    "conceptCode": "20077-4",
    "vocabularyId": "LOINC",
    "domainId": "Measurement",
    "recommendedUnitConceptId": 44777590,
    "recommendedUnitName": "centimeter watercolumn",
    "recommendedUnitCode": "cm[H2O]",
    "recommendedUnitVocabularyId": "UCUM"
  },
  {
    "conceptId": 4160171,
    "conceptName": "Best positive end expiratory pressure",
    "conceptCode": "398269008",
    "vocabularyId": "SNOMED",
    "domainId": "Observation",
    "recommendedUnitConceptId": 44777590,
    "recommendedUnitName": "centimeter watercolumn",
    "recommendedUnitCode": "cm[H2O]",
    "recommendedUnitVocabularyId": "UCUM"
  },
  {
    "conceptId": 3035822,
    "conceptName": "Intrinsic PEEP Respiratory system",
    "conceptCode": "38199-6",
    "vocabularyId": "LOINC",
    "domainId": "Measurement",
    "recommendedUnitConceptId": 44777590,
    "recommendedUnitName": "centimeter watercolumn",
    "recommendedUnitCode": "cm[H2O]",
    "recommendedUnitVocabularyId": "UCUM"
  },
  {
    "conceptId": 42528515,
    "conceptName": "Extrinsic PEEP Respiratory system",
    "conceptCode": "83386-3",
    "vocabularyId": "LOINC",
    "domainId": "Measurement",
    "recommendedUnitConceptId": 44777590,
    "recommendedUnitName": "centimeter watercolumn",
    "recommendedUnitCode": "cm[H2O]",
    "recommendedUnitVocabularyId": "UCUM"
  },
  {
    "conceptId": 42527140,
    "conceptName": "Total PEEP Respiratory system",
    "conceptCode": "76247-6",
    "vocabularyId": "LOINC",
    "domainId": "Measurement",
    "recommendedUnitConceptId": 44777590,
    "recommendedUnitName": "centimeter watercolumn",
    "recommendedUnitCode": "cm[H2O]",
    "recommendedUnitVocabularyId": "UCUM"
  },
  {
    "conceptId": 1616406,
    "conceptName": "Base excess standard in Central venous blood by calculation",
    "conceptCode": "97547-4",
    "vocabularyId": "LOINC",
    "domainId": "Measurement",
    "recommendedUnitConceptId": 8753,
    "recommendedUnitName": "millimole per liter",
    "recommendedUnitCode": "mmol/L",
    "recommendedUnitVocabularyId": "UCUM"
  },
  {
    "conceptId": 1616922,
    "conceptName": "Base excess in Central venous blood by calculation",
    "conceptCode": "97546-6",
    "vocabularyId": "LOINC",
    "domainId": "Measurement",
    "recommendedUnitConceptId": 8753,
    "recommendedUnitName": "millimole per liter",
    "recommendedUnitCode": "mmol/L",
    "recommendedUnitVocabularyId": "UCUM"
  },
  {
    "conceptId": 3010329,
    "conceptName": "Base excess standard in Mixed venous blood by calculation",
    "conceptCode": "19238-5",
    "vocabularyId": "LOINC",
    "domainId": "Measurement",
    "recommendedUnitConceptId": 8753,
    "recommendedUnitName": "millimole per liter",
    "recommendedUnitCode": "mmol/L",
    "recommendedUnitVocabularyId": "UCUM"
  },
  {
    "conceptId": 3021421,
    "conceptName": "Base excess standard in Arterial blood by calculation",
    "conceptCode": "19235-1",
    "vocabularyId": "LOINC",